{
  "spec_version": "0.3",
  "profile_id": "RISU_AGENT_CLOSURE_V0",
  "time_basis": "BUNDLE_MONOTONIC_MS",
  "root": { "id": "agent-3", "new_business_authority": "BLOCKED", "quiesced_at_ms": 100, "quiescence_evidence_ref": "root-blocked" },
  "domain_bindings": [
    { "domain": "AUTHORITY", "status": "COVERED", "source_ids": ["inventory"], "evidence_ref": null },
    { "domain": "EXECUTION", "status": "COVERED", "source_ids": ["inventory"], "evidence_ref": null },
    { "domain": "COMMITMENT", "status": "COVERED", "source_ids": ["inventory"], "evidence_ref": null },
    { "domain": "OPERATIONAL_STATE", "status": "COVERED", "source_ids": ["inventory"], "evidence_ref": null }
  ],
  "sources": [
    { "id": "inventory", "domains": ["AUTHORITY", "EXECUTION", "COMMITMENT", "OPERATIONAL_STATE"], "stability_contract": { "type": "BOUNDED_LAG", "max_visibility_lag_ms": 0 } }
  ],
  "scans": [
    {
      "scan_id": "c3-scan-1", "observed_at_ms": 100,
      "sources": [
        {
          "source_id": "inventory", "coverage": "COMPLETE", "attribution_coverage": "COMPLETE", "stability_witness": null, "evidence_refs": ["inventory-scan-1"],
          "residuals": [
            { "id": "purchase-order", "class": "COMMITMENT", "disposition": "SETTLE", "presence": "PRESENT", "effect": "ACTIVE", "root_linkage": "LIVE", "settlement": "PENDING", "successor_id": null, "transfer_acceptance": "NOT_APPLICABLE", "evidence_refs": ["purchase-pending"] }
          ],
          "lineage_edges": [
            { "from": "$root", "to": "purchase-order", "type": "DERIVED_FROM", "evidence_ref": "root-created-purchase" }
          ]
        }
      ]
    }
  ]
}
